[I 2025-03-20 20:31:45,072] A new study created in memory with name: Stock LSTM Hyperparameter Tuning
[I 2025-03-20 20:32:58,519] Trial 0 finished with value: 1.0372108221054077 and parameters: {'sequence_length': 147, 'hidden_dim': 234, 'num_layers': 1, 'dropout': 0.33930960583094977, 'learning_rate': 0.00021421665569423075, 'batch_size': 64, 'num_epochs': 60, 'optimizer': 'RMSprop'}. Best is trial 0 with value: 1.0372108221054077.
[I 2025-03-20 20:33:50,232] Trial 1 finished with value: 0.737079918384552 and parameters: {'sequence_length': 87, 'hidden_dim': 153, 'num_layers': 2, 'dropout': 0.4755953347734666, 'learning_rate': 0.0017851621886235617, 'batch_size': 16, 'num_epochs': 34, 'optimizer': 'RMSprop'}. Best is trial 1 with value: 0.737079918384552.
[I 2025-03-20 20:36:41,637] Trial 2 finished with value: 0.7578898668289185 and parameters: {'sequence_length': 39, 'hidden_dim': 136, 'num_layers': 3, 'dropout': 0.009576055372586267, 'learning_rate': 0.0001312467662147458, 'batch_size': 8, 'num_epochs': 77, 'optimizer': 'Adam'}. Best is trial 1 with value: 0.737079918384552.
[I 2025-03-20 20:37:34,095] Trial 3 finished with value: 1.0775812864303589 and parameters: {'sequence_length': 42, 'hidden_dim': 195, 'num_layers': 3, 'dropout': 0.4761042233260503, 'learning_rate': 0.00890964708789742, 'batch_size': 64, 'num_epochs': 80, 'optimizer': 'SGD'}. Best is trial 1 with value: 0.737079918384552.
[I 2025-03-20 20:37:49,886] Trial 4 finished with value: 1.087605595588684 and parameters: {'sequence_length': 23, 'hidden_dim': 124, 'num_layers': 1, 'dropout': 0.06866701681814286, 'learning_rate': 0.00011499798085947112, 'batch_size': 128, 'num_epochs': 61, 'optimizer': 'Adam'}. Best is trial 1 with value: 0.737079918384552.
[I 2025-03-20 20:37:51,422] Trial 5 pruned. 
[I 2025-03-20 20:37:53,880] Trial 6 pruned. 
[I 2025-03-20 20:39:41,367] Trial 7 finished with value: 0.9135304093360901 and parameters: {'sequence_length': 103, 'hidden_dim': 56, 'num_layers': 3, 'dropout': 0.46685690087632264, 'learning_rate': 0.005107658354735002, 'batch_size': 8, 'num_epochs': 65, 'optimizer': 'RMSprop'}. Best is trial 1 with value: 0.737079918384552.
[I 2025-03-20 20:39:43,281] Trial 8 pruned. 
[I 2025-03-20 20:39:44,910] Trial 9 pruned. 
[I 2025-03-20 20:39:49,927] Trial 10 pruned. 
[I 2025-03-20 20:43:06,551] Trial 11 finished with value: 0.7578939199447632 and parameters: {'sequence_length': 75, 'hidden_dim': 151, 'num_layers': 2, 'dropout': 0.20755764055341164, 'learning_rate': 0.0005332498443319924, 'batch_size': 8, 'num_epochs': 84, 'optimizer': 'RMSprop'}. Best is trial 1 with value: 0.737079918384552.
[I 2025-03-20 20:43:09,183] Trial 12 pruned. 
[I 2025-03-20 20:44:18,072] Trial 13 finished with value: 0.8719300031661987 and parameters: {'sequence_length': 50, 'hidden_dim': 98, 'num_layers': 2, 'dropout': 0.0033603142132102156, 'learning_rate': 0.0006256986847047751, 'batch_size': 8, 'num_epochs': 50, 'optimizer': 'RMSprop'}. Best is trial 1 with value: 0.737079918384552.
[I 2025-03-20 20:44:24,776] Trial 14 pruned. 
[I 2025-03-20 20:44:26,131] Trial 15 pruned. 
[I 2025-03-20 20:46:49,218] Trial 16 finished with value: 0.8159942030906677 and parameters: {'sequence_length': 64, 'hidden_dim': 237, 'num_layers': 2, 'dropout': 0.117299654429115, 'learning_rate': 0.0012834787561936448, 'batch_size': 16, 'num_epochs': 91, 'optimizer': 'RMSprop'}. Best is trial 1 with value: 0.737079918384552.
[I 2025-03-20 20:46:51,984] Trial 17 pruned. 
[I 2025-03-20 20:46:54,608] Trial 18 pruned. 
[I 2025-03-20 20:46:56,151] Trial 19 pruned. 
[I 2025-03-20 20:46:58,613] Trial 20 pruned. 
[I 2025-03-20 20:47:06,870] Trial 21 pruned. 
[I 2025-03-20 20:47:10,176] Trial 22 pruned. 
[I 2025-03-20 20:50:28,116] Trial 23 finished with value: 0.8022396564483643 and parameters: {'sequence_length': 80, 'hidden_dim': 175, 'num_layers': 2, 'dropout': 0.007423100707065601, 'learning_rate': 0.0008267672586409669, 'batch_size': 8, 'num_epochs': 80, 'optimizer': 'RMSprop'}. Best is trial 1 with value: 0.737079918384552.
[I 2025-03-20 20:50:31,418] Trial 24 pruned. 
[I 2025-03-20 20:51:40,239] Trial 25 finished with value: 0.7693853974342346 and parameters: {'sequence_length': 36, 'hidden_dim': 154, 'num_layers': 1, 'dropout': 0.2070084265747843, 'learning_rate': 0.0014257234563781985, 'batch_size': 16, 'num_epochs': 87, 'optimizer': 'RMSprop'}. Best is trial 1 with value: 0.737079918384552.
[I 2025-03-20 20:51:44,262] Trial 26 pruned. 
[I 2025-03-20 20:51:50,934] Trial 27 pruned. 
[I 2025-03-20 20:51:53,548] Trial 28 pruned. 
[I 2025-03-20 20:51:55,345] Trial 29 pruned. 
[I 2025-03-20 20:51:58,871] Trial 30 pruned. 
[I 2025-03-20 20:53:06,713] Trial 31 finished with value: 0.8262477517127991 and parameters: {'sequence_length': 33, 'hidden_dim': 159, 'num_layers': 1, 'dropout': 0.21814272750012367, 'learning_rate': 0.001503948415731998, 'batch_size': 16, 'num_epochs': 88, 'optimizer': 'RMSprop'}. Best is trial 1 with value: 0.737079918384552.
[I 2025-03-20 20:53:58,362] Trial 32 finished with value: 0.7314378619194031 and parameters: {'sequence_length': 4, 'hidden_dim': 178, 'num_layers': 1, 'dropout': 0.23380603053231552, 'learning_rate': 0.0010570771786961055, 'batch_size': 16, 'num_epochs': 85, 'optimizer': 'RMSprop'}. Best is trial 32 with value: 0.7314378619194031.
[I 2025-03-20 20:54:02,024] Trial 33 pruned. 
[I 2025-03-20 20:54:03,157] Trial 34 pruned. 
[I 2025-03-20 20:54:04,728] Trial 35 pruned. 
[I 2025-03-20 20:54:06,274] Trial 36 pruned. 
[I 2025-03-20 20:54:07,740] Trial 37 pruned. 
[I 2025-03-20 20:54:11,141] Trial 38 pruned. 
[I 2025-03-20 20:54:13,721] Trial 39 pruned. 
[I 2025-03-20 20:54:15,755] Trial 40 pruned. 
[I 2025-03-20 20:55:20,329] Trial 41 finished with value: 0.7441690564155579 and parameters: {'sequence_length': 29, 'hidden_dim': 161, 'num_layers': 1, 'dropout': 0.1877622038659314, 'learning_rate': 0.0010887960158424278, 'batch_size': 16, 'num_epochs': 87, 'optimizer': 'RMSprop'}. Best is trial 32 with value: 0.7314378619194031.
[I 2025-03-20 20:55:23,229] Trial 42 pruned. 
[I 2025-03-20 20:56:24,333] Trial 43 finished with value: 0.7675689458847046 and parameters: {'sequence_length': 12, 'hidden_dim': 178, 'num_layers': 1, 'dropout': 0.1802991101020573, 'learning_rate': 0.000990289091537514, 'batch_size': 16, 'num_epochs': 95, 'optimizer': 'RMSprop'}. Best is trial 32 with value: 0.7314378619194031.
[I 2025-03-20 20:56:28,421] Trial 44 pruned. 
[I 2025-03-20 20:56:29,740] Trial 45 pruned. 
[I 2025-03-20 20:56:33,723] Trial 46 pruned. 
[I 2025-03-20 20:56:35,405] Trial 47 pruned. 
[I 2025-03-20 20:56:40,337] Trial 48 pruned. 
[I 2025-03-20 20:56:42,941] Trial 49 pruned. 
Study statistics: 
 Number of finished trials:  50
  Number of pruned trials:  35
  Number of complete trials:  15
Best trial:
  Value:  0.7314378619194031
  Params: 
    sequence_length: 4
    hidden_dim: 178
    num_layers: 1
    dropout: 0.23380603053231552
    learning_rate: 0.0010570771786961055
    batch_size: 16
    num_epochs: 85
    optimizer: RMSprop